{
  "$schema": "https://json-schema.org/draft/2020-12/schema",
  "$id": "careeros/job",
  "type": "object",
  "required": ["schema", "id", "company_slug", "title"],
  "properties": {
    "schema": { "type": "integer", "minimum": 1 },
    "id": { "type": "string", "pattern": "^[a-z0-9]+(-[a-z0-9]+)*$" },
    "company_slug": { "type": "string", "pattern": "^[a-z0-9]+(-[a-z0-9]+)*$" },
    "client": { "type": ["string", "null"], "default": null, "x-ui": { "label": "Client (via recruiter)" } },
    "title": { "type": "string", "minLength": 1, "x-ui": { "label": "Role" } },
    "source": { "enum": ["ats", "adzuna", "browser", "pasted"], "default": "pasted" },
    "source_site": { "type": "string", "default": "", "x-ui": { "label": "Found on" } },
    "url": { "type": "string", "default": "", "x-ui": { "label": "Job ad" } },
    "apply_via": { "type": "string", "default": "", "x-ui": { "label": "Apply via" } },
    "posted": { "type": "string", "default": "", "x-ui": { "label": "Posted" } },
    "posted_approx": { "type": "boolean", "x-ui": { "label": "Posted date is approximate" } },
    "found_at": { "type": "string", "default": "" },
    "location": { "type": "string", "default": "", "x-ui": { "label": "Location" } },
    "work_mode": { "type": "string", "default": "", "x-ui": { "label": "Work mode" } },
    "job_type": { "type": "string", "default": "", "x-ui": { "label": "Job type" } },
    "salary": {
      "type": "object", "default": {},
      "properties": {
        "min": { "type": ["number", "null"], "default": null },
        "max": { "type": ["number", "null"], "default": null },
        "currency": { "type": "string", "default": "" },
        "period": { "type": "string", "default": "" },
        "text": { "type": "string", "default": "", "x-ui": { "label": "Salary" } }
      }
    },
    "work_rights": {
      "type": "object", "default": {},
      "properties": {
        "label": {
          "enum": ["sponsorship_offered", "visa_ok", "silent", "citizen_pr_only", "clearance"], "default": "silent",
          "x-ui": { "label": "Work rights in the ad", "options": { "sponsorship_offered": "Sponsorship offered", "visa_ok": "Open to visa holders", "silent": "Not mentioned", "citizen_pr_only": "Citizens/PR only", "clearance": "Security clearance" } }
        },
        "quotes": { "type": "array", "items": { "type": "string" }, "default": [] },
        "decided_by": { "enum": ["none", "scan", "claude", "user"], "default": "none" }
      }
    },
    "scores": {
      "type": "object", "default": {},
      "properties": {
        "fit": { "type": "object", "default": {}, "properties": { "value": { "type": ["number", "null"], "default": null }, "must_haves": { "type": "array", "default": [] }, "nice_to_haves": { "type": "array", "default": [] } } },
        "sponsor": { "type": "object", "default": {}, "properties": { "value": { "type": ["number", "null"], "default": null }, "tier": { "type": "string", "default": "" }, "reasons": { "type": "array", "items": { "type": "string" }, "default": [] } } },
        "career": { "type": "object", "default": {}, "properties": { "match": { "type": ["number", "null"], "default": null }, "odds": { "type": ["number", "null"], "default": null }, "tier": { "type": "string", "default": "" }, "scored_at": { "type": "string", "default": "" } } }
      }
    },
    "status": { "enum": ["Found", "Saved", "Applying", "Applied", "Interview", "Offer", "Rejected", "No response", "Withdrawn", "Skipped"], "default": "Found", "x-ui": { "label": "Status" } },
    "interview_at": { "type": "string", "pattern": "^(\\d{4}-\\d{2}-\\d{2}T\\d{2}:\\d{2})?$" },
    "offer": {
      "type": "object",
      "properties": {
        "base": { "type": ["number", "null"], "minimum": 0 },
        "super_rate": { "type": ["number", "null"], "minimum": 0, "maximum": 0.5 },
        "bonus": { "type": ["number", "null"], "minimum": 0 },
        "equity": { "type": "string", "maxLength": 200 },
        "work_mode": { "type": "string", "maxLength": 200 },
        "commute": { "type": "string", "maxLength": 200 },
        "start_date": { "type": "string", "pattern": "^(\\d{4}-\\d{2}-\\d{2})?$" }
      }
    },
    "timeline": {
      "type": "array", "default": [],
      "items": { "type": "object", "required": ["at", "event"], "properties": { "at": { "type": "string" }, "event": { "type": "string" }, "note": { "type": "string", "default": "" } } }
    },
    "files": {
      "type": "array", "default": [],
      "items": { "type": "object", "required": ["path"], "properties": { "path": { "type": "string" }, "label": { "type": "string", "default": "" }, "at": { "type": "string", "default": "" } } }
    },
    "custom": { "type": "object", "default": {} }
  }
}
